<!ELEMENT school (student+)>
<!ELEMENT student (name, age)>
<!ELEMENT name (#PCDATA)>
<!ELEMENT age (#PCDATA)>

<!ATTLIST student id ID #REQUIRED>
<!ATTLIST student status (active|inactive|graduated) #IMPLIED>